{
  "schema_version": "1.0",
  "skill_id": "bid-technical-writing",
  "project_id": "REPLACE_ME",
  "artifact_id": "REPLACE_ME",
  "revision": 1,
  "created_at": "2026-09-27T00:00:00Z",
  "status": "draft",
  "inputs": [],
  "summary": "模板，填写本次实际内容后再核验。",
  "data": {
    "chapters": [],
    "responses": [],
    "unresolved_claims": []
  },
  "warnings": [
    "此文件是空模板，不是执行结果。"
  ],
  "blockers": []
}
